{
  "_type": "https://in-toto.io/Statement/v1",
  "subject": [
    {
      "name": "runward",
      "digest": {
        "sha256": "2287b8c94ac0ce0984a45a84468c4cdc9a2d16223c76bcb4a03ccb7165efd8e0"
      }
    }
  ],
  "predicateType": "https://runward.dev/verdict/v1",
  "predicate": {
    "runward": "0.43.1",
    "mission": "runward",
    "currentGate": "all gates passed",
    "adrCount": 4,
    "strict": true,
    "verdict": "clean",
    "exitCode": 0,
    "gaps": {
      "deliverables": 0,
      "conformance": 0,
      "hooks": 0,
      "deferred": 0,
      "proposed": 0,
      "unboundRows": 0,
      "charter": 0,
      "causesByKind": {}
    },
    "deliverables": [
      {
        "phase": "1 · Frame",
        "artifact": "Framing note",
        "relPath": "framing.md",
        "state": "filled",
        "cause": null,
        "phaseId": "frame"
      },
      {
        "phase": "1 · Frame",
        "artifact": "Steering contract",
        "relPath": "mission-contract.md",
        "state": "filled",
        "cause": null,
        "phaseId": "frame"
      },
      {
        "phase": "2 · Architect",
        "artifact": "Architecture note",
        "relPath": "architecture.md",
        "state": "filled",
        "cause": null,
        "phaseId": "architect"
      },
      {
        "phase": "2 · Architect",
        "artifact": "Execution topology",
        "relPath": "execution-topology.md",
        "state": "filled",
        "cause": null,
        "phaseId": "architect"
      },
      {
        "phase": "2 · Architect",
        "artifact": "Decision matrix",
        "relPath": "decision-matrix.md",
        "state": "filled",
        "cause": null,
        "phaseId": "architect"
      },
      {
        "phase": "2 · Architect",
        "artifact": "Decision journal (≥1 ADR)",
        "relPath": "adr",
        "state": "filled",
        "cause": null,
        "phaseId": "architect"
      },
      {
        "phase": "2 · Architect",
        "artifact": "Port contracts (≥1 filled)",
        "relPath": "contracts",
        "state": "filled",
        "cause": null,
        "phaseId": "architect"
      },
      {
        "phase": "3 · Floor",
        "artifact": "Floor note (measured proof)",
        "relPath": "floor.md",
        "state": "filled",
        "cause": null,
        "phaseId": "floor"
      },
      {
        "phase": "5 · Govern (day zero)",
        "artifact": "Threat model",
        "relPath": "governance/threat-model.md",
        "state": "filled",
        "cause": null,
        "phaseId": "govern"
      },
      {
        "phase": "5 · Govern (day zero)",
        "artifact": "Evaluation rubric",
        "relPath": "governance/evaluation-rubric.md",
        "state": "filled",
        "cause": null,
        "phaseId": "govern"
      },
      {
        "phase": "5 · Govern (day zero)",
        "artifact": "Observability schema",
        "relPath": "governance/observability-schema.md",
        "state": "filled",
        "cause": null,
        "phaseId": "govern"
      },
      {
        "phase": "6 · Hand over",
        "artifact": "Recovery runbook",
        "relPath": "runbook.md",
        "state": "filled",
        "cause": null,
        "phaseId": "handover"
      },
      {
        "phase": "6 · Hand over",
        "artifact": "Hand-over note (the kit, proven)",
        "relPath": "handover.md",
        "state": "filled",
        "cause": null,
        "phaseId": "handover"
      }
    ],
    "through": null,
    "horizon": null,
    "corpusPin": null,
    "corpusDrift": null,
    "conformance": [],
    "evidence": {
      "rows": 46,
      "applied": 21,
      "deviated": 3,
      "na": 22,
      "typed": 20,
      "prose": 1,
      "proseRows": [
        {
          "deliverable": "execution-topology.md",
          "rule": "topology-usage-registry-present"
        }
      ],
      "signed": 5,
      "evidenceFiles": {
        "total": 35,
        "external": 29
      },
      "duplicated": []
    },
    "corpus": {
      "status": "verifiable",
      "missing": [],
      "edited": [],
      "extra": []
    },
    "seal": {
      "present": false,
      "count": 0,
      "sealedAt": null,
      "violations": 0
    },
    "criticalScope": {
      "total": 45,
      "mapped": 41,
      "unmapped": [
        "patterns-memory-router-tiered",
        "routing-model-cost-ratios",
        "routing-smart-complexity",
        "scaling-distributed-rate-limiting"
      ]
    },
    "ratification": {
      "rows": 48,
      "lineByLine": 2,
      "enBloc": 46,
      "blind": 0,
      "untraced": 0,
      "byRow": [
        {
          "deliverable": "architecture.md",
          "rule": "contracts-governance",
          "phaseId": "architect",
          "state": "ratified",
          "mode": "en bloc",
          "by": "Thibault Souris",
          "for": null,
          "date": "2026-09-27",
          "bound": "f517a5b24bf0985d",
          "current": "f517a5b24bf0985d",
          "unboundCause": null
        },
        {
          "deliverable": "architecture.md",
          "rule": "hexa-adapter-pattern",
          "phaseId": "architect",
          "state": "ratified",
          "mode": "en bloc",
          "by": "Thibault Souris",
          "for": null,
          "date": "2026-09-27",
          "bound": "4c3ec18b00ad401f",
          "current": "4c3ec18b00ad401f",
          "unboundCause": null
        },
        {
          "deliverable": "architecture.md",
          "rule": "hexa-architecture",
          "phaseId": "architect",
          "state": "ratified",
          "mode": "en bloc",
          "by": "Thibault Souris",
          "for": null,
          "date": "2026-09-27",
          "bound": "4b01ad48b08b0ef7",
          "current": "4b01ad48b08b0ef7",
          "unboundCause": null
        },
        {
          "deliverable": "architecture.md",
          "rule": "hexa-typescript-native",
          "phaseId": "architect",
          "state": "ratified",
          "mode": "en bloc",
          "by": "Thibault Souris",
          "for": null,
          "date": "2026-09-27",
          "bound": "cd6b031b19f3f667",
          "current": "cd6b031b19f3f667",
          "unboundCause": null
        },
        {
          "deliverable": "architecture.md",
          "rule": "process-adr-and-journal",
          "phaseId": "architect",
          "state": "ratified",
          "mode": "en bloc",
          "by": "Thibault Souris",
          "for": null,
          "date": "2026-09-27",
          "bound": "ba0024729a3d6561",
          "current": "ba0024729a3d6561",
          "unboundCause": null
        },
        {
          "deliverable": "architecture.md",
          "rule": "security-mcp-server-pinning",
          "phaseId": "architect",
          "state": "ratified",
          "mode": "en bloc",
          "by": "Thibault Souris",
          "for": null,
          "date": "2026-09-27",
          "bound": "eefd149606b62108",
          "current": "eefd149606b62108",
          "unboundCause": null
        },
        {
          "deliverable": "execution-topology.md",
          "rule": "topology-port-placement-mapped",
          "phaseId": "topology",
          "state": "ratified",
          "mode": "en bloc",
          "by": "Thibault Souris",
          "for": null,
          "date": "2026-09-27",
          "bound": "32c0d5d7a71cf06d",
          "current": "32c0d5d7a71cf06d",
          "unboundCause": null
        },
        {
          "deliverable": "execution-topology.md",
          "rule": "topology-sovereignty-by-data-class",
          "phaseId": "topology",
          "state": "ratified",
          "mode": "en bloc",
          "by": "Thibault Souris",
          "for": null,
          "date": "2026-09-27",
          "bound": "547e7e29ac5a198a",
          "current": "547e7e29ac5a198a",
          "unboundCause": null
        },
        {
          "deliverable": "execution-topology.md",
          "rule": "topology-trace-export-decision",
          "phaseId": "topology",
          "state": "ratified",
          "mode": "en bloc",
          "by": "Thibault Souris",
          "for": null,
          "date": "2026-09-27",
          "bound": "f291531a286bbd34",
          "current": "f291531a286bbd34",
          "unboundCause": null
        },
        {
          "deliverable": "execution-topology.md",
          "rule": "topology-usage-registry-present",
          "phaseId": "topology",
          "state": "ratified",
          "mode": "en bloc",
          "by": "Thibault Souris",
          "for": null,
          "date": "2026-09-27",
          "bound": "c7d7e32a17b5c82b",
          "current": "c7d7e32a17b5c82b",
          "unboundCause": null
        },
        {
          "deliverable": "floor.md",
          "rule": "config-secrets-boundary",
          "phaseId": "floor",
          "state": "ratified",
          "mode": "en bloc",
          "by": "Thibault Souris",
          "for": null,
          "date": "2026-09-27",
          "bound": "dac699e6001082a6",
          "current": "dac699e6001082a6",
          "unboundCause": null
        },
        {
          "deliverable": "floor.md",
          "rule": "frontier-deterministic-boundary",
          "phaseId": "floor",
          "state": "ratified",
          "mode": "en bloc",
          "by": "Thibault Souris",
          "for": null,
          "date": "2026-09-27",
          "bound": "eda9c2eb22cc04e2",
          "current": "eda9c2eb22cc04e2",
          "unboundCause": null
        },
        {
          "deliverable": "floor.md",
          "rule": "hexa-adapter-pattern",
          "phaseId": "floor",
          "state": "ratified",
          "mode": "en bloc",
          "by": "Thibault Souris",
          "for": null,
          "date": "2026-09-27",
          "bound": "77fe0f8aed942c01",
          "current": "77fe0f8aed942c01",
          "unboundCause": null
        },
        {
          "deliverable": "floor.md",
          "rule": "hexa-architecture",